{
  "schema_version": "1.0.0",
  "contract_version": "0.1.0",
  "contract_id": "BX-QUALITY-CONTRACT-BROWSER-0.1",
  "stage": "section-5.1",
  "status": "reviewed-proposed-unmeasured",
  "owner_roles": [
    "architecture-owner",
    "browser-profile-owner",
    "product-owner",
    "quality-owner",
    "security-owner"
  ],
  "measurement_policy": {
    "threshold_semantics": "proposed-release-boundary-not-a-measurement",
    "statistics": ["exact", "maximum", "median", "p95", "p99", "rate"],
    "sample_policy": "Run the declared minimum after one discarded setup run; retain every raw sample, tool version, manifest identity, and environment fingerprint.",
    "variance_policy": "Report median, p95, range, and coefficient of variation; instability above ten percent requires investigation and cannot be hidden by averaging.",
    "regression_policy": "Compare like-for-like immutable manifests; a five-percent regression requires review and a budget breach blocks the owning gate regardless of baseline movement.",
    "exception_policy": "A waiver must name one metric and profile, explain user impact, identify mitigation and owner, expire within one release, and never convert missing evidence into a pass.",
    "freshness_policy": "Release evidence must be reproduced for the candidate manifest on governed environments within thirty days and after any relevant runtime, renderer, asset, or build change."
  },
  "environments": [
    {
      "id": "BX-ENV-ASSET-PRODUCTION",
      "class": "asset-build",
      "hardware": "governed release builder recorded by immutable fingerprint",
      "browser": "not-applicable build inspection",
      "network": "not-applicable local artifact inspection",
      "cache": "not-applicable",
      "power": "not-applicable",
      "use": "Production compression, source-map exposure, integrity, and payload accounting."
    },
    {
      "id": "BX-ENV-CI-REFERENCE",
      "class": "ci",
      "hardware": "four dedicated logical cores and eight GiB memory minimum",
      "browser": "pinned headless browser from the candidate support window",
      "network": "local deterministic fixture transport",
      "cache": "cold",
      "power": "not-applicable",
      "use": "Repeatable build, lifecycle, queue, cleanup, and renderer contract measurements."
    },
    {
      "id": "BX-ENV-DESKTOP-COLD",
      "class": "desktop",
      "hardware": "four-core reference laptop class with eight GiB memory",
      "browser": "each BH-01 candidate desktop browser window",
      "network": "10 Mbps down, 2 Mbps up, 80 ms round-trip, no loss",
      "cache": "cold",
      "power": "mains",
      "use": "Cold transfer, parse, instantiate, startup, and first-root readiness."
    },
    {
      "id": "BX-ENV-DESKTOP-WARM",
      "class": "desktop",
      "hardware": "four-core reference laptop class with eight GiB memory",
      "browser": "each BH-01 candidate desktop browser window",
      "network": "10 Mbps down, 2 Mbps up, 80 ms round-trip, no loss",
      "cache": "warm",
      "power": "mains",
      "use": "Warm startup, local interaction, DOM update, memory, and repeated lifecycle measurements."
    },
    {
      "id": "BX-ENV-MOBILE-COLD",
      "class": "mobile",
      "hardware": "mid-tier four-year-old mobile device class with four GiB memory",
      "browser": "each BH-01 candidate mobile browser window",
      "network": "1.6 Mbps down, 750 Kbps up, 150 ms round-trip, one percent loss",
      "cache": "cold",
      "power": "battery-normal",
      "use": "Constrained cold startup and first-root readiness without thermal throttling."
    },
    {
      "id": "BX-ENV-MOBILE-WARM",
      "class": "mobile",
      "hardware": "mid-tier four-year-old mobile device class with four GiB memory",
      "browser": "each BH-01 candidate mobile browser window",
      "network": "1.6 Mbps down, 750 Kbps up, 150 ms round-trip, one percent loss",
      "cache": "warm",
      "power": "battery-normal",
      "use": "Constrained warm interaction, update, resource, reconnect, and server-command measurements."
    }
  ],
  "budgets": [
    {
      "id": "BX-BUD-BUILD-RELEASE-SECONDS",
      "dimension": "build",
      "subject": "clean production browser-profile build",
      "unit": "seconds",
      "statistic": "p95",
      "direction": "at-most",
      "proposed_threshold": 180,
      "environment_refs": ["BX-ENV-CI-REFERENCE"],
      "minimum_samples": 10,
      "measurement_method": "Time a dependency-cached clean profile build with immutable inputs and retain phase timing plus the output manifest.",
      "severity": "release-review",
      "exception_policy": "time-bounded-waiver",
      "owner": "build-owner",
      "first_measurement_milestone": "BH-01",
      "measurement_state": "proposed-unmeasured",
      "evidence_ids": []
    },
    {
      "id": "BX-BUD-INTERACTION-DOM-UPDATE-MS",
      "dimension": "interaction",
      "subject": "normalized renderer update to committed DOM paint",
      "unit": "milliseconds",
      "statistic": "p95",
      "direction": "at-most",
      "proposed_threshold": 50,
      "environment_refs": ["BX-ENV-DESKTOP-WARM", "BX-ENV-MOBILE-WARM"],
      "minimum_samples": 100,
      "measurement_method": "Replay the governed keyed-update fixture and measure renderer receipt through the next painted frame with browser tracing.",
      "severity": "release-blocking",
      "exception_policy": "profile-specific-waiver",
      "owner": "dom-renderer-owner",
      "first_measurement_milestone": "BH-04",
      "measurement_state": "proposed-unmeasured",
      "evidence_ids": []
    },
    {
      "id": "BX-BUD-INTERACTION-LOCAL-EVENT-PAINT-MS",
      "dimension": "interaction",
      "subject": "local normalized event through visible paint",
      "unit": "milliseconds",
      "statistic": "p95",
      "direction": "at-most",
      "proposed_threshold": 100,
      "environment_refs": ["BX-ENV-DESKTOP-WARM", "BX-ENV-MOBILE-WARM"],
      "minimum_samples": 100,
      "measurement_method": "Dispatch the governed local action fixture and correlate normalized event, component update, renderer commit, and painted frame timestamps.",
      "severity": "release-blocking",
      "exception_policy": "profile-specific-waiver",
      "owner": "browser-profile-owner",
      "first_measurement_milestone": "BH-01",
      "measurement_state": "proposed-unmeasured",
      "evidence_ids": []
    },
    {
      "id": "BX-BUD-INTERACTION-SERVER-ROUNDTRIP-MS",
      "dimension": "interaction",
      "subject": "authenticated server command through acknowledged result",
      "unit": "milliseconds",
      "statistic": "p95",
      "direction": "at-most",
      "proposed_threshold": 1000,
      "environment_refs": ["BX-ENV-MOBILE-WARM"],
      "minimum_samples": 50,
      "measurement_method": "Execute the governed authenticated command against a deterministic regional server fixture and retain client/server correlation timestamps.",
      "severity": "release-review",
      "exception_policy": "profile-specific-waiver",
      "owner": "server-adapter-owner",
      "first_measurement_milestone": "BH-07",
      "measurement_state": "proposed-unmeasured",
      "evidence_ids": []
    },
    {
      "id": "BX-BUD-PAYLOAD-APPLICATION-COMPRESSED-KIB",
      "dimension": "payload",
      "subject": "minimal application code compressed transfer",
      "unit": "kibibytes",
      "statistic": "maximum",
      "direction": "at-most",
      "proposed_threshold": 250,
      "environment_refs": ["BX-ENV-ASSET-PRODUCTION"],
      "minimum_samples": 3,
      "measurement_method": "Build the governed minimal application and sum Brotli-compressed application-owned chunks from the content-addressed manifest.",
      "severity": "release-review",
      "exception_policy": "time-bounded-waiver",
      "owner": "build-owner",
      "first_measurement_milestone": "BH-01",
      "measurement_state": "proposed-unmeasured",
      "evidence_ids": []
    },
    {
      "id": "BX-BUD-PAYLOAD-APPLICATION-UNCOMPRESSED-KIB",
      "dimension": "payload",
      "subject": "minimal application decoded bytes",
      "unit": "kibibytes",
      "statistic": "maximum",
      "direction": "at-most",
      "proposed_threshold": 700,
      "environment_refs": ["BX-ENV-ASSET-PRODUCTION"],
      "minimum_samples": 3,
      "measurement_method": "Build the governed minimal application and sum decoded application-owned chunks from the content-addressed manifest.",
      "severity": "release-review",
      "exception_policy": "time-bounded-waiver",
      "owner": "build-owner",
      "first_measurement_milestone": "BH-01",
      "measurement_state": "proposed-unmeasured",
      "evidence_ids": []
    },
    {
      "id": "BX-BUD-PAYLOAD-CHART-PACKAGE-KIB",
      "dimension": "payload",
      "subject": "optional chart package compressed transfer",
      "unit": "kibibytes",
      "statistic": "maximum",
      "direction": "at-most",
      "proposed_threshold": 450,
      "environment_refs": ["BX-ENV-ASSET-PRODUCTION"],
      "minimum_samples": 3,
      "measurement_method": "Build the chart-only feature fixture and sum newly reachable Brotli-compressed code and default chart assets.",
      "severity": "release-review",
      "exception_policy": "time-bounded-waiver",
      "owner": "charts-package-owner",
      "first_measurement_milestone": "BH-17",
      "measurement_state": "proposed-unmeasured",
      "evidence_ids": []
    },
    {
      "id": "BX-BUD-PAYLOAD-DATA-PACKAGE-KIB",
      "dimension": "payload",
      "subject": "optional data package compressed transfer",
      "unit": "kibibytes",
      "statistic": "maximum",
      "direction": "at-most",
      "proposed_threshold": 250,
      "environment_refs": ["BX-ENV-ASSET-PRODUCTION"],
      "minimum_samples": 3,
      "measurement_method": "Build the data-only feature fixture and sum newly reachable Brotli-compressed runtime-heavy package chunks.",